id,text,page,side,word_count,source
chunk_18_LEFT,"importance of identifying abnormalities on CT scan that do 
not require clinical intervention, such as small intracranial 
haematomas and small non-depressed skull fractures. 
Clearly it is important to identify intracranial lesions that 
require neurosurgical intervention but is it beneficial to 
identify abnormalities on CT scan that do not require 
intervention? Concerns about radiation exposure and 
resource utilisation have influenced this debate. The trend 
in the literature is to develop strategies to identify clinically 
important lesions while minimising the number of CT 
scans performed. The outcome of this strategy is that a 
small number of minor abnormalities on CT will be missed. 
Therefore, not all abnormalities detected on CT scan should 
be regarded as clinically important.
Acute clinical symptoms associated with mild head injury 
are common and are sometimes referred to as concussion 
symptoms. These include abnormal mental status (alertness/
behaviour/cognition), post traumatic amnesia, vomiting, 
headache, dizziness and lethargy. In the majority of mild 
head injury patients, their acute clinical symptoms will 
rapidly improve and they may be left with mild post 
concussion symptoms or return to completely normal. In 
most patients these symptoms start to improve within a 
couple of hours of injury and it is unusual for significant 
symptoms to persist for more than 4 hours post time 
of injury. Persistent acute clinical symptoms indicate a 
significant functional injury and an underlying structural 
lesion should be ruled out with a CT scan. Patients with 
persistent acute clinical symptoms with a normal CT scan 
should be admitted to hospital for prolonged observation 
until their symptoms start to improve. They should have 
continued neurological observations and post traumatic 
amnesia (PTA) testing. 
Post concussion symptoms are relatively common following 
mild head injury and may have significant cognitivebehavioural-social impact on patients and their families.3, 
8-10, 76, 93-99 Post concussion symptoms include headaches, 
dizziness, fatigue, memory problems and other cognitive, 
behavioural and social dysfunction. Post concussion 
symptoms have been shown in some studies to occur in 
up to 25 - 50% of patients with mild head injury,3, 8, 10, 76, 
94-96, 98, 99 but in about 10% of cases they may persist with 
at times significant psychological overlay as post concussion 
syndrome.3, 8, 10, 76, 94, 98, 99 In an Australian study Faux et 
al100 found that 15% of patients with mild traumatic brain 
injury continued to complain of post traumatic headache 
at 3 months compared to 2% of controls. These symptoms 
usually resolve within three months. The cognitivePAGE 16  Initial Management of Closed Head Injury in Adults, 2nd Edition  NSW HEALTH",18,LEFT,418,Page 18 (LEFT)
chunk_18_RIGHT,"behavioural-social dysfunction caused by mild head 
injury can be quite disabling, and some researchers have 
suggested that the severity of impact on lifestyle makes the 
term ‘mild’ inappropriate for some patients.3, 98, 99 Patients 
with significant persistent post concussive symptoms 
should be referred to a brain injury rehabilitation service or 
neurologist by their GP (see Appendix 7).
Most of the studies looking at post concussion 
symptoms included patients with initial GCS 13-15 with 
either transient confusion or disorientation or loss of 
consciousness (<30 min) or PTA (<24 hours) who did not 
require neurosurgery. Therefore, they tended to exclude 
lower risk patients without loss of consciousness or amnesia 
and include higher risk patients with initial GCS 13 when 
compared to the definition of mild head injury used in 
this guideline. The inclusion of patients without loss of 
consciousness or amnesia and the classification of patients 
with initial GCS 13 as moderate head injury means that 
the incidence of post concussion symptoms may be less 
common in the patients classified as mild head injury in 
this guideline. However, Lannsjo et al96 in a population 
based study of patients with initial GCS 15 found that 
about 34% of patients reported multiple (3 or more on 
the Rivermead Questionnaire) significant ongoing post 
concussion symptoms at three months. Kraus et al95 found 
about 30% of their patients (GCS 13-15) had a similar 
frequency of multiple symptoms although it is interesting 
to note that about 20% of their control group of patients 
attending ED for other problems reported multiple 
symptoms. Kraus et al95 found that headaches, dizziness, 
forgetfulness and frustration were the Rivermead symptoms 
that best identified mild head injury patients from the 
controls. Clearly, post concussion symptoms occur in many 
mild head injury patients but it is difficult to define which 
patients will get multiple persistent symptoms due to the 
mild head injury as many symptoms are common to other 
conditions, as well as the general population. The findings 
of these recent studies again emphasised the importance 
of providing education and follow up information regarding 
post concussion symptoms to all patients with mild 
head injury as a significant minority may have persistent 
symptoms. 
Post concussion symptoms are relatively common following 
mild head injury and may have significant cognitivebehavioural-social impact on patients and their families. 
Mild head injury patients with structural lesions on CT scan, 
significant acute clinical symptoms or significant PTA are 
at increased risk of post concussion symptoms but post",18,RIGHT,406,Page 18 (RIGHT)
chunk_19_LEFT,"concussion symptoms can occur in the absence of these 
features. The only interventions that have been shown to 
be beneficial for post concussion symptoms are education, 
reassurance and time.95, 101, 102 Therefore, it is important to 
provide education about post concussion symptoms to all 
mild head injury patients. 
Further information on post concussion symptoms and 
The clinically important complications of mild head injury suggest that the management priorities should be:
- The identiﬁ cation of patients requiring early acute neurosurgical intervention.
- The identiﬁ cation of patients requiring admission to hospital due to the increased risk of deterioration from complications.
- The identiﬁ cation of patients who can be safely discharged for home observation.
- The provision of discharge advice to allow the identiﬁ cation and early return of patients with unexpected deterioration.
- The provision of discharge advice to allow the identiﬁ cation, treatment and follow-up of patients who develop signiﬁ cant 
post concussion symptoms.
Initial Management of Closed Head Injury in Adults, 2nd Edition  NSW HEALTH  PAGE 17",19,LEFT,170,Page 19 (LEFT)
chunk_19_RIGHT,"brain injury rehabilitation can be found in the Motor 
Accidents Authority of NSW 'Guidelines for mild traumatic 
brain injury following a closed head injury103 and Evidence 
Table 2.",19,RIGHT,28,Page 19 (RIGHT)
chunk_20_LEFT,"3. 
How should patients with mild head injury be assessed?
RECOMMENDATION
Strength of 
recommendation
Mild head injury patients should be assessed by a process of structured clinical assessment involving a 
combination of:
- initial clinical history and examination
- serial clinical observations 
- CT scanning if clinically indicated by risk factors identiﬁ ed on initial or serial assessment
Serial clinical observation should include minimum hourly observations of :
- vital signs. 
- pupillary reactions 
- GCS 
- alertness / behaviour / cognition
- post traumatic amnesia (PTA) (eg A-WPTAS)
If patients have no signiﬁ cant risk factors for complications of mild head injury and are clinically judged 
to be “low risk” then they should be observed until at least four hours post time of injury. 
If patients have any signiﬁ cant risk factors for complications of mild head injury then they should 
continue to be clinically observed while further assessment is performed. 
Serial clinical observations should be continued on any mild head injury patients who fail to clinically 
improve at four hours post injury or who are found to have structural lesions on CT scan.
Assessment for PTA should be performed on all mild head injury patients in the emergency department. 
Mild head injury patients who are admitted to hospital because they have structural lesions, persistent 
PTA or clinical symptoms should have daily PTA testing until they are shown to be out of PTA.
Clinical assessment using clinical risk factors or clinical decision rules can identify those patients at 
increased risk of intracranial injury requiring further investigation.
CT scanning is indicated for those mild head injured patients identiﬁ ed by structured clinical assessment 
as being at increased risk of intracranial injury.
CT scanning is the most appropriate investigation for the exclusion of neurosurgically signiﬁ cant lesions 
in mild head injured patients
If structured clinical assessment indicates the risk of intracranial injury is low, the routine use of CT 
scanning is neither clinically beneﬁ cial nor cost effective.
Skull x-rays are not sufﬁ ciently sensitive to be used as a routine screening investigation to identify 
signiﬁ cant intracranial lesions.
PAGE 18  Initial Management of Closed Head Injury in Adults, 2nd Edition  NSW HEALTH",20,LEFT,362,Page 20 (LEFT)
chunk_21_LEFT,"Clinical history and examination remain the basis for the 
initial assessment of patients with closed head injury. 
However, additional clinical tools are available to assist in 
assessment and management. These clinical tools include 
Glasgow Coma Scale (GCS), initial serial neurological 
observation, post traumatic amnesia (PTA) testing, 
clinical decision rules, CT scanning and prolonged clinical 
observation in hospital.
Glasgow coma scale
The Glasgow Coma Scale (Appendix 5) was originally 
developed by Teasdale and Jennett104 for the neurological 
observation of patients with prolonged coma. It was 
intended to ensure inter-observer reliability and to identify 
deterioration of patients over time. Since its original 
introduction its use has been extended such that it is now 
the standard tool for assessment of level of consciousness 
in many clinical settings. 
GCS is used both for the initial assessment and classification 
of closed head injuries and for serial assessment of closed 
head injuries. Initial GCS on admission to hospital is used 
to classify head injuries into the broad prognostic groups 
of mild (GCS 14-15), moderate (GCS 9-13) and severe 
(GCS 3-8). The Brain Trauma Foundation concluded that 
there is good quality evidence to relate initial GCS score 
to outcome.15 However, it must be noted that these are 
broad outcome measures and initial GCS is only about 75% 
accurate so treatment should be individualised.15
GCS is unreliable if measured before initial resuscitation 
and stabilisation of the ABCDE’s has been completed.15 
Fearnside et al105 identified that both intubation and 
sedation interfered with accurate assessment of initial 
GCS in more severely injured patients and there is lack 
of uniformity of approach to classifying GCS in these 
situations.
The other significant area of controversy relates to timing of 
initial GCS. In unstable patients requiring resuscitation, the 
optimal time to record initial GCS remains controversial.15, 
105 Similarly, in mild head injury patients the time of 
presentation related to time of injury will influence the 
initial GCS and therefore potentially influence clinical 
decision making in relation to CT scanning.6, 10, 31, 35 
Perhaps the most crucial point to note about initial GCS is 
that it cannot predict individual outcome for patients with 
similar GCS scores. Thus, an individual patient with an initial 
GCS of 14-15 may have a variety of outcomes including 
Initial Management of Closed Head Injury in Adults, 2nd Edition  NSW HEALTH  PAGE 19",21,LEFT,383,Page 21 (LEFT)
chunk_21_RIGHT,"no significant injury, long-term cognitive-behavioural 
dysfunction or a life threatening extradural haematoma.
This is particularly important for mild head injury patients 
because GCS primarily assesses the risk of structural lesions. 
Subtle cognitive changes are not well discriminated within 
the mild head injury group. This led to the development of 
the extended Glasgow Coma Scale and the Abbreviated 
Westmead PTA Scale that assess the duration of post 
traumatic amnesia as a means of identifying patients at 
increased risk of cognitive problems.106-109 Despite these 
limitations initial GCS on admission remains the standard 
method for initial classification of head injuries.
When assessing initial GCS in patients with head injury it is 
worthwhile considering time of injury. Clearly initial GCS for 
a given patient may vary depending on time of presentation 
to hospital. Few studies have related GCS to the time of 
injury with the exception of Stiell et al35 who found GCS 
<15 at two hour post injury was a significant predictor of 
intracranial injury for mild head injury patients. Most recent 
studies that have reported time of presentation have shown 
that mild head injuries present around 60 to 90 minutes 
post injury.31, 43, 54 An abnormal initial GCS taken within 
one hour of injury is therefore likely to overestimate the 
risk of intracranial injury in mild head injury patients who 
present early.
Prehospital GCS, motor score and return of orientation 
are other factors to consider when assessing initial GCS. 
Prehospital GCS was felt to be unreliable,110 but with 
more organised prehospital systems, it is gaining further 
attention.15, 111 Motor score is the best predictor of outcome 
of the GCS components.15 Orientation returns most 
commonly in the sequence of person, place then time.112 
The Glasgow Coma Scale is used as one of the parameters 
in serial observation of head injury patients. This is what 
it was originally designed for and what it is most useful 
for. Both the original studies and subsequent studies have 
validated its use in this fashion and, prior to the advent 
of CT scanning, alteration in GCS was the most useful 
tool in predicting intracranial injury.9, 104 Borg et al101 in 
a meta analysis for the World Health Organisation on 
mild traumatic brain injury concluded that in the absence 
of CT scanning that hospital observation for at least 24 
hours for patients with GCS 15 and other risk factors was 
a reasonable strategy. Currently, serial GCS remains a 
standard tool in the monitoring of head injuries when CT 
scanning is unavailable or when clinical symptoms persist",21,RIGHT,417,Page 21 (RIGHT)
chunk_22_LEFT,"despite normal CT scanning.
Summary
- Initial GCS scores are useful to classify closed head 
injuries into broad prognostic groups requiring further 
assessment and serial observation.
- Serial GCS scores are useful to observe the trend in 
clinical condition over time for all patients
- Serial GCS scores may be used as alternative to CT 
scanning in patients with mild head injury and GCS 15 
when CT scanning is not available
- Serial GCS scores are useful for identifying patients 
with significant risk of intracranial injury in:
  
-  patients with an initial abnormal GCS score who fail 
to improve
  
- patients whose initial GCS score deteriorates.
- Initial and serial GCS scores are not as valuable in 
excluding significant injury in:
  
-  patients with an initial normal GCS score who remain 
normal
  
-  patients with an initial abnormal GCS score who 
improve.
- Initial GCS should only be used for prognostic purposes 
after initial resuscitation and stabilisation of ABCDE’s.
- The motor component of the GCS is the best predictor 
of outcome 
- The extended GCS or Abbreviated Westmead PTA 
Scale which assess both GCS and duration of PTA are 
designed to help identify mild head injury patients 
at increased risk of post concussion symptoms by 
identifying more subtle cognitive changes.
Serial clinical neurological observation
Serial clinical neurological observations remain a standard 
tool for assessing mild head injury patients despite the 
advent of CT scanning. CT scanning is primarily used to 
identify structural abnormalities at a given point in time 
while serial neurological observations are used to monitor 
clinical condition over a longer period of time. Serial 
neurological observation typically consists of at least hourly 
pupillary reactions and GCS assessment in conjunction 
with vital signs. The symmetry of motor responses and a 
standardised orientation assessment should be routinely 
noted as part of the GCS. Neurological assessment should 
also include qualitative assessment of alertness, behaviour 
and cognition as this may identify more subtle neurological 
impairment. 
In mild head injury patients the primary aims of serial 
PAGE 20  Initial Management of Closed Head Injury in Adults, 2nd Edition  NSW HEALTH",22,LEFT,352,Page 22 (LEFT)
chunk_22_RIGHT,"neurological observation are the early identification of 
acute neurological deterioration and the identification and 
monitoring of persistent mild neurological deficits. Serial 
neurological observations remain the basic standard of care 
for the initial management of mild head injury patients and 
should be used in conjunction with clinical decision rules 
to determine the need for CT scanning and / or prolonged 
observation. The qualitative aspects of serial neurological 
observation may assist in identifying acute deterioration 
or subtle functional abnormality before there is a change 
in GCS. Subtle drowsiness, mild disorientation to time, 
inattention and mildly disorganised thought processes with 
subtle post traumatic amnesia can easily be missed by over 
reliance on GCS in a patient who is awake and orientated in 
person and place.
Controversy exists over the appropriate duration of serial 
neurological observation for both mild head injury patients 
who are improving and those who have persistent clinical 
symptoms or abnormalities on CT scan. Although four 
hours of initial neurological observations post injury are 
fairly standard following mild head injury, there is little 
evidence to support this. There is also some debate as to 
whether the initial period of observation should be until 
four hours post injury or for four hours following arrival 
at hospital. Studies that reported time of presentation 
showed that most patients present at one to two hours 
post injury. Clinically most uncomplicated mild head injury 
patients will start to improve within two to four hours post 
time of injury. Stiell et al35 demonstrated that GCS<15 at 
two hours post injury was one of the most significant risk 
factors for intracranial injury. Since this guideline has used 
these clinically important criteria, it was felt that the initial 
clinical observation period should also be based on time 
post injury rather than four hours observation from the 
time of arrival at hospital. It is important that patients who 
present one hour post injury are not treated the same as 
those who present at four hours post injury with “routine 
observations” for four hours. If the patient who presents 
at four hours post injury is not clinically improving then 
they are at increased risk of intracranial injury and warrant 
CT scanning whereas the same patient at one hour post 
injury probably only requires observation unless there is 
another strong indication for CT scanning eg suspected 
skull fracture, seizure, warfarin etc. The initial period of 
neurological observation should therefore be until at 
least four hours post time of head injury at which point 
clinical decisions should be made if they are not clinically 
improving.",22,RIGHT,422,Page 22 (RIGHT)
chunk_23_LEFT,"If the serial clinical neurological observations of patients 
with an initial GCS 15 at 2 hours post injury are improving 
or have returned to normal at four hours post injury then 
the evidence would suggest it is safe to discharge them for 
home observation if they have no risk factors indicating the 
need for CT scan or if they have an initial normal CT scan. 
There is no strong evidence to support a specific duration 
of time of observation. Observation until 4 hours post time 
of injury should be used as an initial guide. Patients with 
trivial injuries could be considered for earlier discharge 
by an experienced senior clinician and patients with high 
risk factors should be considered for longer periods of 
observation. 
If serial neurological observations are not improving at 
four hours post injury then serial neurological observations 
should be continued and clinical decisions need to be 
made about the need for CT scanning and/or admission 
to hospital for prolonged observation. The period of 
admission to hospital for prolonged observation is also 
controversial as there is little evidence to support the 
general recommendation of twenty four hours. This period 
of observation is derived from studies that show that 
clinical deterioration is unusual in mild head injury patients 
after twenty four hours. Indeed, prior to the advent of CT 
scanning serial clinical observation was the standard of 
care and the need for neurosurgical intervention in mild 
head injury patients was largely determined on the basis 
of clinical deterioration. The best location for prolonged 
neurological observation for lower risk patients is also 
debated because some studies have shown that admission 
to hospital does not guarantee that regular neurological 
observation will occur.53
If patients are not clinically improving or have abnormalities 
on CT scan that warrant hospital admission, then serial 
clinical observations should be continued. The duration 
of this time of observation remains poorly defined. 
Basically, clinical observation should be continued until 
clinical symptoms improve or until it is felt there is little 
risk of deterioration. This needs to be individualised but a 
minimum of 24 hours is normally recommended.101
Summary
- Serial neurological observation is a useful tool for the 
early identification of acute neurological deterioration 
and the identification and monitoring of persistent mild 
neurological deficits.
Initial Management of Closed Head Injury in Adults, 2nd Edition  NSW HEALTH  PAGE 21",23,LEFT,389,Page 23 (LEFT)
chunk_23_RIGHT,"- Serial neurological observations should include 
a minimum of hourly GCS assessment, pupillary 
reactions, PTA and vital signs. Neurological 
observations should also include qualitative assessment 
of alertness, behaviour and cognition to detect subtle 
changes in mental status not assessed by the Glasgow 
Coma Scale.
- Mild head injury patients should have initial serial 
neurological observations until at least four hours post 
time of injury at which point decisions about further 
management should be made.
- Serial neurological observations should be continued 
on patients who are admitted to hospital for at least 
24 hours and until patients clinically improve and are 
discharged home. 
Post traumatic amnesia (PTA) testing
Amnesia for the event, short-term memory loss, 
anterograde amnesia and PTA are all terms used to 
describe the disruption of memory that typically results 
from a traumatic head injury. The different terms describe 
a continuum of memory disruption, and the use of the 
individual terms depends on the duration of memory 
loss and individual preference. Amnesia for the event 
is common and of little clinical significance. Retrograde 
and anterograde amnesia are typically used to refer to 
the duration of loss of memory for events preceding or 
following an injury. PTA is the period of time during which 
a person is unable to lay down new memories following 
an injury. PTA and anterograde amnesia essentially refer to 
the same phenomena but some patients may have memory 
for events yet still be unable to lay down new memories 
– the so called islands of memory. Stiell et al56 identified a 
duration of greater than 30 minutes of retrograde amnesia 
as being a significant risk factor for intracranial injury. 
Smits et al47 identified a duration of PTA of greater than 2 
hours as being a minor risk factor and greater than 4 hours 
as being a major risk factor for intracranial injury. Many 
studies have shown that persistent PTA is a significant risk 
factor for poor functional outcome in all grades of head 
injury. Any persistent inability to lay down new memories 
following blunt trauma is perhaps most simply referred to 
as PTA and the duration of PTA may be used to predict 
the risk of intracranial injury and the risk of persistent 
post concussion symptoms. PTA is the term that will be 
predominantly used in this guideline.",23,RIGHT,382,Page 23 (RIGHT)
