id,text,page,side,word_count,source
chunk_35_LEFT,"include it in their clinical decision rules. Mower et al58 
found that severe headache was a risk factor but did not 
include it in their clinical decision rule. Interestingly, in a 
later study, Clement et al77 found that severe headache was 
a significant risk factor for those patients with GCS 15 who 
required neurosurgical intervention. 
The general trend of the literature would suggest that mild 
headache is not a significant concern but persistent severe 
headache should be considered a significant risk factor for 
intracranial injury.
Coagulopathy or bleeding disorder
Known coagulopathy or bleeding disorder is both 
a strong indication for early CT scan and also an 
indication to check the INR and to consider reversal 
of anticoagulation. Anticoagulated patients with any 
evidence of haemorrhage on CT scan should have 
early rapid reversal of anticoagulation. Patients with 
a supra-therapeutic INR (>4) should be considered 
for either partial or full reversal and admitted to 
hospital for prolonged observation. Prolonged 
observation and follow up repeat CT scan should 
be considered for any anticoagulated patients or 
patients with bleeding disorders.39, 42, 53, 54, 63, 74, 
85-87, 110, 115, 153, 162, 172, 174, 187
Most guidelines and studies on mild head injury mention 
coagulopathy or bleeding disorder either as a significant 
risk factor or an exclusion criteria in the assessment of 
risk of intracranial injury.42, 53, 74, 85, 87, 115, 153, 162, 172, 
174, 187 However, there was no compelling evidence to 
either support or refute this reasonable assertion in 
the mild head injury patient group until recently. Mina 
et al147 demonstrated that pre-existing anticoagulation 
significantly increased the risk of death from intracranial 
injury in trauma patients with head injury. However, this 
was a heterogenous patient group with significantly 
abnormal ISS (mean 17.0 +/- 7.8) and GCS (mean 11.8 
+/- 4.0). Subsequent small studies by Franko et al,78 Ivascu 
et al,79 Cohen et al,148 Fabbri et al41 and Allard et al149 
have all demonstrated significant risk of both intracranial 
haemorrhage and mortality in anti-coagulated head injury 
patients. Cohen et al148 and Ivascu et al79 both found that 
patients with mild head injury were at significant risk of 
intracranial injury and acute deterioration particularly if 
they had an increased INR. An initial normal CT scan did 
not exclude the possibility of deterioration. Franko et al78 
Initial Management of Closed Head Injury in Adults, 2nd Edition  NSW HEALTH  PAGE 33",35,LEFT,393,Page 35 (LEFT)
chunk_35_RIGHT,"also demonstrated a link between increased mortality 
and increased INR (>4). Ivascu et al79 demonstrated that 
early rapid reversal of warfarin in patients with intracranial 
haemorrhage significantly improved mortality. 
Mild head injury patients who are warfarinised are at 
significantly increased risk of traumatic intracranial 
haemorrhage particularly if they are elderly or overwarfarinised. Note that this increased risk applies to 
asymptomatic patients. They should all receive an urgent CT 
scan and have an early INR checked. Patients who have a 
traumatic injury on CT scan or who have a supratherapeutic 
INR (>4) should be admitted for observation and should 
be strongly considered for short term reversal of their anticoagulation as they are at high risk of acute deterioration 
and death. A routine repeat CT scan within 24 hours or an 
urgent repeat CT scan if there are any signs of deterioration 
is recommended for these patients. Clinical judgement is 
required about the disposition of patients with an initial 
normal CT scan and normal INR. Prolonged observation 
and close follow up either in hospital or in the community 
is reasonable until further evidence is available to guide 
management.
The evidence is less clear about the risk of traumatic ICH 
associated with anti-platelet agents or bleeding disorders. 
There are very few studies specifically addressing the issue 
and those that have been done provide contradictory 
findings.9, 89, 129, 164 There is a clear trend to suggest 
patients on anti-platelets have an increased risk of bleeding 
following intracranial haemorrhage but limited evidence 
to prove that anti-platelets independently increase the risk 
of intracranial haemorrhage for mild head injury patients. 
Extrapolating from existing anti-coagulation protocols, 
population studies on stroke and other studies on mild head 
injury, it would be reasonable to postulate that increasing 
age and the presence of more than one anti-platelet agent 
would increase the risk of bleeding. Since most patients 
on anti-platelet agents are elderly and elderly patients are 
recommended to have routine CT scans, the remaining 
clinical dilemma is what is the risk of delayed bleeding. At 
present this remains unknown and prolonged observation 
and close follow up in the community is probably prudent. 
Age
Patient age >65 years is a strong indication for CT 
scanning.20, 38, 47, 53, 60, 74, 85, 88, 115, 153, 162, 172, 174",35,RIGHT,375,Page 35 (RIGHT)
chunk_36_LEFT,"The literature has shown that there is an increased risk of 
intracranial injury for patients aged over 60-65 years with 
mild head injury.20, 38, 47, 53, 60, 74, 85, 88, 101, 115, 162, 172, 174 All 
the recently published clinical decision rules have included 
age over 60 or 65 years as a major risk factor. Mack et al150 
recommended routine head CT for elderly patients suffering 
mild head injury as they could not identify any useful clinical 
predictors of intracranial injury in the elderly. Similarly, 
Rathlev et al151 analysed the elderly patients from the 
NEXUS II trial and found that there was an increased risk of 
intracranial risk with age and that occult presentation was 
more common. The Brain Trauma Foundation15 concluded 
that ‘increasing age is a strong independent factor in 
prognosis, with significant increase in poor outcome above 
60 years of age’ for patients with severe head injuries. 
Similarly, Williams et al76 demonstrated that elderly patients 
were more likely to sustain complications of mild head 
injury. Servadei et al6 have pointed out it is unlikely there is 
a specific age at which risk of intracranial injury dramatically 
increases. Fabbri et al31 found that using age >60 years 
alone to predict the need for CT scanning in patients with 
mild head injury was impractical from a cost-resource 
consideration during a study to validate a set of guidelines. 
Interestingly, of the 705 patients meeting guidelines criteria 
for CT scanning based on age >60 years alone who did not 
have CT scans, Fabbri et al31 found that only one patient 
deteriorated within 48 hours. It is worth noting that the 
NSW Institute of Trauma and Injury Management Trauma 
Death Review Committee has identified that in 2003 / 
2004 elderly NSW patients with head injuries represented a 
significant number of potentially preventable deaths.152 
Patients aged >65 with a mild head injury should have a 
CT scan due to the increased risk of intracranial injury. If CT 
scan is not available and the patient has no other identified 
risk factors then the absolute risk is probably small and 
clinical judgement can be used to justify prolonged 
observation rather than transfer for CT scan. Prolonged 
observation in hospital or at home should be considered 
even if an initial CT scan is normal due to the increased risk 
of delayed complications.
Abnormal alertness, behaviour or cognition
Persistent abnormal mental status manifested by 
abnormal alertness, abnormal behaviour or cognitive 
impairment is a strong indication for CT scanning.38, 
49, 55, 58, 74, 94, 97, 103, 115, 133, 174
Persistent abnormal mental status manifested by abnormal 
PAGE 34  Initial Management of Closed Head Injury in Adults, 2nd Edition  NSW HEALTH",36,LEFT,441,Page 36 (LEFT)
chunk_36_RIGHT,"alertness, abnormal behaviour or cognitive impairment 
has been shown to be strongly associated with intracranial 
injury.38, 74, 115, 174 Mower et al58 used abnormal alertness 
or behaviour as major criteria in their clinical decision rule 
and Clement et al77 found confusion, restlessness and 
abnormal 3 object recall as significant risks. Similarly, in 
the paediatric literature, abnormal mental status has been 
identified as a major risk factor.49, 74, 94 Although initial 
GCS partially assesses mental status, it primarily addresses 
level of consciousness. Clinical observation of alertness, 
behaviour and cognition will detect more subtle changes 
in mental status than GCS and should be part of routine 
neurological observation. Persistent abnormal PTA testing is 
also an indication of abnormal mental status. Detection of 
abnormal alertness or behaviour and cognitive impairment 
requires careful observation by staff and relatives and 
is particularly important for adults with pre-existing 
neurological impairment. In patients with pre-existing 
neurological conditions, a lower threshold for CT scanning 
is appropriate.6, 33 
Most studies do not identify at what time post injury that 
abnormal mental status becomes a definite indication 
for CT scanning. Extrapolating from the GCS <15 at two 
hours post injury risk factor, it would be reasonable to 
identify abnormal mental status as a risk factor at two 
hours post injury and certainly by four hours post injury. 
Clinical judgement is required depending on the degree of 
abnormality as to when to order a CT scan.
Large scalp haematoma or laceration
Large scalp haematomas or lacerations are relative 
indications for CT scanning in adults. Large non 
frontal scalp lacerations have been identified as 
significant risk factors in young children.14, 49, 74, 94, 
115, 123, 130, 162, 174 
The literature is somewhat unclear about the importance 
of scalp haematomas and lacerations as clinical risk factors. 
Haydel et al32 identified “visible trauma above the clavicles” 
as a major risk factor. Mower et al58 identified scalp 
haematoma as a major risk factor and included it in their 
clinical decision rule. Smits et al47 included “contusion to 
the skull” as a minor risk factor in their CHIP rule. In the 
other major adult clinical decision rules and studies, scalp 
haematoma was not identified as a major risk factor but 
was potentially implied under the broad term “suspected 
skull fracture.” In the paediatric literature, non frontal",36,RIGHT,380,Page 36 (RIGHT)
chunk_37_LEFT,"scalp haematoma is included in most clinical decision rules 
particularly among young children.14, 49, 94, 123, 130, 174 There 
is no clear guidance in the literature as to what should be 
considered a significant scalp haematoma or laceration 
other than a trend to “large’ and “non frontal”. There is 
no evidence for the use of descriptors such as “boggy” or 
“tense” to help discriminate between significant and non 
significant haematomas.
Drug or alcohol intoxication
Drug or alcohol ingestion with a normal mental state 
is not an indication for CT scanning. Drug or alcohol 
intoxication resulting in an abnormal mental state is 
an indication for CT scanning.22, 38, 40, 53, 74, 85, 115, 162, 
168, 172, 174 
Drug or alcohol intoxication is frequently present in patients 
with head injury and makes patients difficult to assess and 
manage. Cook et al,60 in a study of alcohol intoxicated 
patients, found that clinical examination could not predict 
which alcohol intoxicated patients had abnormal CT scans. 
However, they observed that the rate of abnormal CT scan 
and neurosurgical intervention was similar to that of the 
non-intoxicated mild head injury population. Several studies 
have suggested that drug or alcohol intoxication is a risk 
factor for intracranial injury but the exact definition of 
intoxication remains vague.31, 32
Since 2004 there have been several large well designed 
studies and clinical decision rules published that have found 
that alcohol is not an independent risk factor for intracranial 
injury in patients with mild head injury.22, 38, 85, 115, 162, 168, 
172 Bracken et al153 looked at the intoxicated patients (3356 
patients) in the NEXUS II database who had received CT 
scans and found that the rate of intracranial injury was 
lower than the non-intoxicated group. Although it would 
appear that alcohol intoxication is not an independent 
risk factor for intracranial injury it remains a common 
clinical dilemma to decide what to do with a head injured 
patient with an abnormal mental status when it is not clear 
whether it is the alcohol or the head injury that is causing 
the abnormality.
Stiell et al35 took a slightly different approach and used GCS 
<15 at two hours post injury as their variable to predict 
abnormal mental status for whatever reason. They argued 
that drug or alcohol intoxication was not an independent 
predictor of intracranial injury if the patient had a normal 
Initial Management of Closed Head Injury in Adults, 2nd Edition  NSW HEALTH  PAGE 35",37,LEFT,404,Page 37 (LEFT)
chunk_37_RIGHT,"mental status at two hours post injury.
From a practical viewpoint, clinically obvious drug or alcohol 
intoxication should be treated as a risk factor for intracranial 
injury because it manifests as abnormal mental status which 
impairs clinical assessment and must be assumed to be 
due to intracranial injury. It seems reasonable to use the 
approach of Stiell et al35 in determining when to order a CT 
scan in the absence of other risk factors.
Dangerous mechanisms of injury
Specifically identified high risk dangerous 
mechanisms that are a strong indication for CT 
scanning include pedestrian/cyclist struck by vehicle, 
ejection from vehicle, falls (>1m) and focal blunt 
trauma to the head (bat, ball, foot). In the absence 
of these specified risk factors or other risk factors, 
dangerous mechanism is a relative indication for CT 
scan in mild head injury patients. Clinical judgment is 
required.20, 38, 60, 72, 88, 115, 162, 172, 174
Epidemiological studies have generally identified motor 
vehicle accidents, falls and assaults as the commonest 
causes of head injuries. In studies on patients with mild 
head injuries, specific high risk factors for intracranial injury 
that have been identified include focal blunt trauma to the 
head,38, 60, 72, 88, 115 pedestrians or cyclists struck by motor 
vehicles,20, 60, 88, 172, 174 ejection from motor vehicle,172, 174 
and falls with variable heights specified.38, 172, 174
Multi-system trauma
In mild head injury patients with multi-system 
trauma, clinical judgement is required regarding the 
need for CT scanning, particularly in the presence of 
unstable vital signs or associated injuries requiring 
significant amounts of analgesia, procedural sedation 
or general anaesthesia.162, 172, 174 
Most guidelines and studies on mild head injury have 
specifically excluded patients with multi-system trauma 
or unstable vital signs.162, 172, 174 It is therefore difficult 
to make evidence based recommendations and clinical 
judgment is required. A low threshold for performing head 
CT scan in multi-system trauma patients should be used as 
subtle neurological signs are easily missed in the presence 
of distracting injuries. Similarly, clinicians should have a",37,RIGHT,333,Page 37 (RIGHT)
chunk_38_LEFT,"low threshold for performing CT scans where associated 
injuries require significant amounts of analgesia, procedural 
sedation or general anaesthesia. 
Pre-existing neurosurgery/neurological 
impairment
Pre-existing neurosurgery or neurological impairment 
is a relative indication for CT scanning.85, 153, 168 
Pre-existing neurosurgery has been suggested as an 
indication for CT scanning particularly in the presence 
of hydrocephalus and shunt placement.6, 33 Sevadei et 
al6 recommended routine CT scanning for patients with 
either previous neurosurgery or epilepsy. From a practical 
viewpoint, any pre-existing medical condition resulting 
in neurological impairment (eg stroke, dementia, and 
developmental delay) may make clinical assessment difficult. 
More recent studies have been unable to enrol sufficient 
numbers of patients to give clear guidance about these risk 
factors.48 
Delayed presentation or representation
Delayed presentation or representation are relative 
indications for CT scanning. Clinical judgement is 
required. Patients who present more than four hours 
post injury with persistent or new clinical symptoms 
should be regarded as being at relatively high risk for 
intracranial injury.4, 6, 44, 53, 114, 119 
Although mild head injuries are very common it is thought 
that the majority do not present to hospital.114, 119 
Therefore, those that do present to hospital are already a 
group at slightly increased risk. Of particular concern are 
those who have a delayed presentation due to persistence 
of symptoms or those who represent because of ongoing 
or new symptoms. Most of the larger studies have excluded 
patients who presented more than 24 hours post injury 
or who represented, so there is a lack of evidence about 
these patients. However, it is clear from most of the 
studies that patient’s who have persistent or new abnormal 
mental status, or persistent or new clinical symptoms such 
as vomiting or severe headache, have increased risk of 
intracranial injury. 
Delayed presentation due to ongoing symptoms should be 
regarded as being the same as failing to return to normal 
after clinical observation. Representation due to persistent 
PAGE 36  Initial Management of Closed Head Injury in Adults, 2nd Edition  NSW HEALTH",38,LEFT,330,Page 38 (LEFT)
chunk_38_RIGHT,"or worsening symptoms should be regarded as the same as 
clinical deterioration during clinical observation. Therefore, 
both patients who have a delayed presentation or who 
represent with new or worsening symptoms should be 
regarded as being at relatively high risk of intracranial injury. 
However, the overall risk of intracranial injury in patients 
who represent after mild head injuries is low if their initial 
risk was low and particularly if they had an initial normal CT 
scan.4, 6, 44, 53 
Unwitnessed event/unreliable history
A good history of injury may help predict risk of intracranial 
injury by identifying dangerous mechanism of injury or 
significant features such as prolonged loss of consciousness 
or seizures. This is of particular importance in children. 
However, in the absence of other significant risk factors 
there are few studies identifying unwitnessed event or 
unreliable history as a significant independent risk factor.140 
Paediatrics
Although paediatrics were excluded from the search 
strategy, the author believes that the evidence in the 
paediatric literature discussed below may assist clinicians 
in their decision making in the management of adults with 
closed head injury. The evidence was not identified in an 
exhaustive systematic literature search but represents the 
most relevant studies identified by the author.
In the past few years there have been several large studies 
looking at paediatric head injuries that have attempted to 
identify clinical risk factors indicating the need for CT scan 
and use these risk factors to develop clinical decision rules. 
Clinical decision rules have been developed for children by 
Palchak et al34 (2003), Haydel et al65 (2003 – New Orleans 
group), Oman et al87 (2006 – NEXUS group), Dunning 
et al138 (2006 – CHALICE group), Atakabi et al83 (2008 - 
Canadian CT Head group) and most recently Kupperman 
et al85 (2009 – PECARN group). Maguire et al86 published 
a systematic view of paediatric clinical prediction rules 
in 2009 that assessed all the major studies except the 
Kupperman study. The studies by Dunning et al enrolled 
22,772 patients and Kupperman et al enrolled 42,412 
patients and these are the two largest well designed studies 
yet performed on either adult or paediatric patients with 
head injuries.
The best predictors of the need for CT scan were similar 
in all the studies and similar to the findings of the adult 
literature. The best predictors present in nearly all prediction",38,RIGHT,387,Page 38 (RIGHT)
chunk_39_LEFT,"rules were abnormal mental status or behaviour (including 
GCS <15 or qualitative assessment), focal neurological 
deficit, clinically suspected skull fracture (non frontal scalp 
haematoma), vomiting and dangerous mechanism. Loss of 
consciousness was significant if “definite” in some and if 
“prolonged” in others. Severe headache and seizures were 
identified as significant in several. 
Kupperman et al85 took the clinically practical step of 
identifying those risk factors which strongly suggested 
the need for CT scan and differentiating them from those 
that required clinical judgement to decide whether to 
observe the child or proceed to CT scan. They made the 
practical point that where clinical judgement was used it 
should be based on experience, number of risk factors and 
a period of observation. In their summary of their clinical 
decision rule, they included their figures on the percentage 
of the population likely to be in each group, and the risk 
of clinically important brain injury in each group. This 
information could be used to help clinicians and parents to 
decide how to proceed for an individual child. 
In summary, the indications for CT scan and the clinical 
prediction rules in the paediatric literature are similar to 
those in the adult literature. There have been large well 
designed studies that support the use of structured clinical 
assessment to identify which patients should have a CT 
scan. Refer to NSW Health Infants & Children: Acute 
Management of Head Injury, second edition (PD2011_024) 
for management of head injury children.
What should be done with high risk 
mild head injury patients when CT 
scan is unavailable?
In patients with high risk mild head injury, a normal CT scan 
combined with clinical assessment will allow the patient to 
be safely discharged for home observation. If CT scan is 
unavailable then the patient will require either admission 
for prolonged observation or early transfer for CT scanning 
depending on clinical assessment of risk. Prolonged clinical 
observation for at least 24 hours, associated with clinical 
improvement, has been shown to make a significant injury 
unlikely in the majority of mild head injury patients.91 
However, those patients at highest risk for an intracranial 
injury identified by persistently abnormal GCS or clinical 
symptoms, deterioration in GCS, focal neurological deficit, 
or significant clinical suspicion of skull fracture should be 
transferred for CT scan to allow the early identification of 
potentially neurosurgically significant injury.
Initial Management of Closed Head Injury in Adults, 2nd Edition  NSW HEALTH  PAGE 37",39,LEFT,403,Page 39 (LEFT)
chunk_39_RIGHT,"It is reasonable to admit some mild head injury patients to 
hospital for serial observation if CT scan is unavailable and 
urgent transfer to neurosurgical care impractical. Prior to 
the widespread availability of CT scanning, admission for 
serial assessment of GCS was the standard treatment for 
patients with head injury. Borg et al101 (2004 diagnostic 
procedures), in a meta analysis for the World Health 
Organisation on mild traumatic brain injury, concluded that 
in the absence of CT scanning, that hospital observation for 
at least 24 hours for patients with GCS 15 and other risk 
factors was a reasonable strategy. Similarly, af Geijerstam et 
al91 found in a large population based study on mild head 
injury patients with GCS 15 that the outcome for a serial 
observation in hospital strategy was similar to the outcome 
for an immediate CT strategy at 3 month follow up. This 
presumed that appropriate care could be delivered in the 
event of deterioration. Clinical judgement is clearly required 
where patients have GCS 15 but clinical symptoms that 
fail to improve with observation. The primary advantage 
of performing an early CT scan is to be able to safely 
discharge a patient if the CT scan is normal. Thus, when 
CT is unavailable, serial clinical observation is a reasonable 
strategy for mild head injury patients with GCS 15 as long 
as patients can be transferred to neurosurgical care in a 
timely fashion in case of deterioration.",39,RIGHT,238,Page 39 (RIGHT)
